{
  "$schema":"http://json-schema.org/draft-07/schema#","type":"object","additionalProperties":false,
  "required":["schema_version","ledger_id","status","created_at","run_id","entry_count","entries","authority"],
  "properties":{"schema_version":{"const":1},"ledger_id":{"type":"string"},"status":{"const":"candidate_private_immutable"},"created_at":{"type":"string","format":"date-time"},"run_id":{"type":"string"},"entry_count":{"type":"integer","minimum":0},"entries":{"type":"array","items":{"$ref":"#/definitions/entry"}},"authority":{"type":"object","additionalProperties":false,"required":["source_approved","methodology_approved","index_eligible","publication_eligible"],"properties":{"source_approved":{"const":false},"methodology_approved":{"const":false},"index_eligible":{"const":false},"publication_eligible":{"const":false}}}},
  "definitions":{"entry":{"type":"object","additionalProperties":false,"required":["evidence_id","seller_display_name","source_url","final_url","retrieved_at","http_status","response_bytes","response_sha256","response_bytes_retained","retention_note","vat_determination","facts","minimal_quote"],"properties":{"evidence_id":{"type":"string"},"seller_display_name":{"type":"string"},"source_url":{"type":"string"},"final_url":{"type":["string","null"]},"retrieved_at":{"type":"string","format":"date-time"},"http_status":{"type":["integer","null"]},"response_bytes":{"type":["integer","null"]},"response_sha256":{"type":["string","null"],"pattern":"^[0-9a-f]{64}$"},"response_bytes_retained":{"const":false},"retention_note":{"type":"string"},"vat_determination":{"type":["string","null"]},"minimal_quote":{"type":"string"},"facts":{"type":"object","additionalProperties":false,"required":["mpn","capacity_gb","module_count","item_price_minor","currency","vat_included"],"properties":{"mpn":{"type":"string"},"capacity_gb":{"type":"integer"},"module_count":{"type":"integer"},"item_price_minor":{"type":"integer"},"currency":{"type":"string"},"vat_included":{"type":"boolean"}}}}}}
}
